<?xml version="1.0" encoding="UTF-8"?>
<?xml-stylesheet type="text/xsl" href="../condition.xsl"?>
<!-- edited with XML Spy v3.5 NT (http://www.xmlspy.com) by Tony Hardee (Perot Systems) -->
<!DOCTYPE division SYSTEM "condition.dtd" [
	<!ENTITY material_doc SYSTEM "SleepDisordersMaterialList.xml">
	<!ENTITY questionnaire_doc SYSTEM "SleepDisordersQuestionnaire.xml">
]>
<division description="General Medicine" name="General Medicine">
	<department description="Neurology" name="Neurology">
		<section description="" name="">
			<condition cost="565.00" description="Sleep Disorders" id="Sleep Disorders">
				<keyword text="sleep"/>
				<keyword text="disorder"/>
				<keyword text="insomnia"/>
				<keyword text="fatigue"/>
				<keyword text="chronic"/>
				<keyword text="snoring"/>
				<keyword text="apnea"/>

				&questionnaire_doc;
				&material_doc;
			</condition>
		</section>
	</department>
</division>
